id,title,created_utc,score,num_comments,selftext,subreddit,sentiment,date,cleaned_title
1g1t2x7,What is a blue and red state which will likely never flip in an election?,2024-10-12 01:15:00,103,202,"When people often talk about presidential elections, there is often a point on whether or not a state could eventually be competitive or if a state will permanently stay the same color.

A common topic which comes under this discussion is Kansas and Minnesota since they are the states which have the longest streak of going red and blue respectively.

However, these states have shown to be trending in a more elastic fashion as Minnesota is heavily relying on the twin cities and Duluth to keep it in the Blue column as seen in 2016 Hilary won Minnesota by less than 2%, with the state even being considered competitive by few medias before Biden dropped out

Kansas on the other hand is starting to trend to the left since 2016 when the once conservative and populous Johnson County started shifting left. It went on to be blue in 2020 and continued that trend even in the 2022 midterms. While KS likely isn't flipping anytime soon, recent trends could mean that the state is a lot more elastic as the Joco, Wichita, and Topeka areas gradually expand in population.

So with KS and MN out of the way, what are the red and blue states which you think have no chance of ever flipping?",PoliticalDiscussion,0.0,2024-10-12,blue red state likely never flip election?
1g1qs25,Does JD Vance refusing to admit Trump losing the election concern you?,2024-10-11 22:50:42,816,510,"JD just had an interview with the New York times in which he refused to admit Trump lost the election in 2020 5 times in a row. 

The question matters in regards to the general population ability to trust our election process. Trump's investigation team dug into the 2020 election and found little to no evidence of material that would discredit the election

They lost 63 court cases appealing the election results

My question is do you guys understand why this question is important. And if you are considering Trump does JD refusing to answer this question matter to you? ",PoliticalDiscussion,0.0,2024-10-11,jd vance refusing admit trump losing election concern you?
1g1cfou,What valid reasons are preventing the US government from allowing citizens to vote online? ,2024-10-11 11:26:47,0,39,"Online voting has been discussed since the late 1990’s. We weren’t ready for it then but why not now? We register to vote online, sign important documents including mortgages and car loans online, and safely do financial transactions. ",PoliticalDiscussion,0.0,2024-10-11,valid reasons preventing us government allowing citizens vote online?
1g18y0x,"(New York Times) How One Polling Decision Is Leading to Two Distinct Stories of the Election.
A methodological choice has created divergent paths of polling results. Is this election more like 2020 or 2022?",2024-10-11 08:46:32,62,31,"***Source***: [*https://www.nytimes.com/2024/10/06/upshot/polling-methods-election.html*](https://www.nytimes.com/2024/10/06/upshot/polling-methods-election.html) ***(Paywall)***

Over the last month, one methodological decision seems to have produced two parallel universes of political polling.

In one universe, Kamala Harris leads only narrowly in the national popular vote against Donald J. Trump, even as she holds a discernible edge in the Northern battlegrounds. The numbers look surprisingly similar to the 2022 midterm election.

In the other, Ms. Harris has a clear lead in the national vote, but the battlegrounds are very tight. It’s essentially a repeat of the 2020 election.

This divide is almost entirely explained by whether a pollster uses “weighting on recalled vote,” which means trying to account for how voters *say* they voted in the last election.

Here’s how it works. First, the pollster asks respondents whether they voted for Joe Biden or Mr. Trump in the last election. Then they use a statistical technique called weighting, in which pollsters give more or less “weight” to respondents from different demographic groups, such that each group represents its actual share of the population. In this case, the pollster weights the number of Biden ’20 or Trump ’20 voters to match the outcome of the last election.

This approach had long been considered a mistake. For reasons we’ll explain, pollsters have avoided it over the years. But they increasingly do it today, partly as a way to try to make sure they have enough Trump supporters after high-profile polling misfires in 2016 and 2020. The choice has become an important fault line among pollsters in this election, and it helps explain the whiplash that poll watchers are experiencing from day to day.

**Over the last month, about two-thirds of polls were weighted by recalled vote.**

An important — and perhaps obvious — consequence of weighting by recalled vote is that it makes poll results look more like the 2020 election results. The polls that don’t do it\*,\* including New York Times/Siena College surveys, are more likely to show clear changes from four years ago.

While the differences between the two sets of polls are relatively small, they add up to two different stories of the election. The polls that *don’t* weight on past vote tend to show results that align more closely with the result of the 2022 midterm election than the last presidential election. They also show that Mr. Trump’s advantage in the Electoral College, with respect to the popular vote, has dwindled over the last four years. The polls weighted on past vote, on the other hand, show little more than a 2020 repeat of the Electoral College gap.

As we’ll see, this is a fraught decision for pollsters. On one hand, weighting on recalled vote would have produced worse results in every presidential election from 2004 to 2020. On the other, it’s the choice that might save pollsters from underestimating Mr. Trump yet again.

**Why this kind of weighting is controversial**

When I started following polling methodology debates 20 years ago, weighting on recalled vote was considered a very bad idea. A surprising number of respondents don’t remember how they voted; they seem likelier to remember voting for the winner; and they sometimes report voting when voting records show they did not.

This pattern has persisted all the way from the first time I read about recall vote all the way to the present, based on data archived at the Roper Center and 2021-24 data from the Pew Research Center and Times/Siena. The same pattern shows up in the exit polls in every presidential election year when it was asked (2004, 2008, 2020).

The tendency for recall vote to overstate the winner of the last election means that weighting on recall vote has a predictable effect: It increases support for the party that lost the last election.

While polls have a lot of issues, underestimating the party that lost the last election doesn’t turn out to be one of them. As a result, weighting on recalled vote would have made the polls less accurate in every election since 2004 (the farthest back considered), based on a re-analysis of 70 polls archived at the Roper Center.

The effect of recall vote in 2020 is especially revealing: The polls that year were so poor that there are individual cases where recall-vote weighting would have helped. For example, it would have produced a smaller lead for Mr. Biden in ABC/Washington Post’s [infamous poll](https://www.washingtonpost.com/politics/2020/10/28/power-up-new-post-abc-polling-shows-biden-with-big-lead-wisconsin-where-coronavirus-cases-are-rising/) showing him leading by 17 points in Wisconsin in October 2020. But it wouldn’t have fixed it, either; by our estimate, it would have still shown Mr. Biden up 12 if recall vote had been used when producing the result. And it would have made most other 2020 polls less accurate, on average, including Times/Siena polls and most of the other ABC/Post polls.

What does it mean if recall vote wouldn’t have been enough to fix the polls four years ago? The most straightforward interpretation: For the 2020 polls to be right, pollsters needed the 2016 recall vote to look “wrong.” The polls needed Mr. Trump to hold a clear lead on recall vote — exactly what one would have expected historically, given the tendency for recall vote to overstate the winner of the previous election.

As a result, recalled vote didn’t even help the polls in the biggest polling misfire in 40 years.

**Why pollsters now weight on recall vote**

Despite that record, many pollsters have decided to weight on recall vote for four main reasons.

First, many pollsters believe recall vote is more reliable than it used to be. Whether it’s accurate enough is another question, but it’s certainly true that recall vote looks “closer” to the last election result than in prior cycles. The last three years of Times/Siena and Pew Research NPORS data show about a three-point gap between recalled 2020 vote and the actual 2020 result, a far cry from the double-digit differences a decade or two ago.

Why could recall vote be getting more accurate? One possibility is that poll respondents have become more likely to remember whom they voted for in the last election, thanks to rising political engagement and polarization. Another possibility is that data collected online may be less vulnerable to whatever it is that causes the “winner bias” (importantly, almost all the reanalyzed polls — where we produced estimates of what a poll’s result might be if it had used recall-vote weighting — were telephone surveys).

This election also features a novel case: The loser of the last election is running again (and most Republicans don’t even believe he lost), and the winner of the last election just lost a rematch, in a sense, against that loser. It’s anyone’s guess how all of this affects the accuracy of recall vote, but it is easy to imagine further mitigation of the traditional “winner bias.”

Second, some pollsters use panels of repeat survey-takers, which means they have responses from them over a long period. A pollster may have asked panelists in 2020 how they voted, as opposed to asking them today to remember how they voted four years ago. This counts as weighting on past vote, but it’s not quite the same as someone’s recalled vote. This approach ought to be less vulnerable to the biases in recall-vote weighting, even if there are still challenges involved — like what to do about any new panelists or changes in the makeup of the electorate since 2020.

Third, recall vote can be used to bludgeon self-evidently unrepresentative data toward a more plausible result. This is especially useful for survey designs with no plausible case for validity, like a poll of people from a single social media platform. No one expects such an approach to yield a good sample, but recall-vote weighting can quickly get it into the ballpark. Indeed, more than 80 percent of opt-in online panel polls weight on recall vote, while other kinds of polls are less likely to do so.

Fourth, recall vote is being used to help address the tendency for polls to understate Mr. Trump’s strength over the last eight years.

As mentioned earlier, weighting on recall vote historically helps the candidate who lost the last election. This year, that’s Mr. Trump. You can see it for yourself in the last round of Times/Siena battleground state polls — almost all of them would have scooted to the right if they had been weighted by recall vote:

**How recent Times/Siena polls would have changed**

* Pennsylvania: Harris +4 (without recall vote) —> Trump +1 (with recall vote)
* Michigan: Harris +1 —> Trump +1
* Wisconsin: Harris +2 —> Trump +1
* North Carolina: Trump +3 —> Trump +6
* Arizona: Trump +5 —> Trump +3
* Georgia: Trump +4 —> Trump +6

Of course, the recall-vote-weighted poll results here represent an entirely plausible outcome. If the polls underestimate Mr. Trump, as they did four or eight years ago, November’s results might look exactly like this. But historically, it’s not surprising that weighting on recall vote would help Republicans: Mr. Trump lost the last election; as such, weighting on recall vote would be expected to give more weight to Trump ’20 voters, and therefore to Mr. Trump today.

When big-name traditional pollsters weight by recall vote, this is usually the reason. Some of these pollsters think it’s a perfectly valid measure, but many only use it grudgingly. They still more or less believe the old arguments against recall vote, but they choose to employ it anyway. They wouldn’t be doing it if they trusted their data to produce unbiased results, and they wouldn’t be doing it if it didn’t shift their polls toward Mr. Trump.

As Patrick Murray of the Monmouth poll put it in [explaining](https://x.com/PollsterPatrick/status/1824477952043618633) his decision to weight on recall vote, “The Trump phenomenon is sui generis, and you have to pick your poison.”

**Did recall vote fix past problems?**

There is some good news contained in this story: Recall-vote weighting is almost certainly reducing the risk that the polls systematically underestimate Mr. Trump, as they did in 2016 or 2020. As we’ve shown, it has given many pollsters a quick and easy fix to move their numbers toward the right.

Many of the worst survey results of the 2020 election seem unlikely to be repeated this time around. For instance, The Washington Post and CNN/SSRS state polls now weight by recall vote, which means we won’t be seeing any results like Biden +17 in Wisconsin or Biden +16 nationwide.

But there’s a strange contradiction between the two major observations so far — and the contradiction points toward real trade-offs involving recall-vote weighting.

On the one hand, many pollsters are weighting on recall vote because it yields more Republican-leaning results.

On the other, the polls weighted like this aren’t necessarily producing especially Republican-leaning results. They don’t look like the hypothetical recall-weighted Times/Siena polls, for instance. Instead, they’re producing results neatly in line with the result of the 2020 election.

**How is that possible? There are two basic possibilities.**

One is that the polls weighted on recall vote are full of highly engaged voters who haven’t shifted since 2020, and therefore weighting on recall vote will produce a 2020 repeat.

Another possibility: It may be employed selectively by pollsters concerned their data is too far to the left. The two theories could be connected, as highly engaged voters have leaned left during the Trump era. Weighting on recall vote, then, would move a group of relatively Democratic-leaning samples neatly in line with the 2020 election result.

Whatever the explanation, this tension suggests significant trade-offs as pollsters weight on recall vote. Most obviously, it may make it harder to identify any changes since the last election. One reason is simply because recall-vote weighting mechanically forces polls toward the last election result. But even deeper than that, the technique is being used, at least in part, because pollsters don’t trust their survey results. It’s an attitude that can lead pollsters to treat surprising and unusual data as suspicious, rather than potentially newsworthy or insightful. This is understandable: I know I don’t always trust our survey results after the last decade of polling misfires. But when legitimate concern about polling morphs into weighting away otherwise outlying findings, it risks squelching any indication of anything that might be out of the ordinary.

In a way, the problem is reminiscent of something [called “herding,”](https://aapor.org/wp-content/uploads/2022/12/Herding-508.pdf) in which pollsters tweak their surveys to bring their results into alignment with the average of other polls. Like herding, the decision to weight on past vote is often a reflection of how pollsters feel about the quality of their underlying data. In this case, however, pollsters aren’t necessarily herding toward what other pollsters say. Instead, they’re essentially herding toward the result of the last presidential election.

A near repeat of the last presidential election is certainly a plausible outcome. In today’s polarized era, who could possibly be surprised by a repeat in Mr. Trump’s third presidential run? If it’s a near repeat, the polls weighted by recall vote won’t just have an excellent night themselves, but they might also spare the entire industry another four years of misery.

But if this election is different, in any direction, this year’s polls might not be able to see it coming.",PoliticalDiscussion,0.3121212121212121,2024-10-11,(new york times) one polling decision leading two distinct stories election. methodological choice created divergent paths polling results. election like 2020 2022?
1g14k58,"What is Benjamin Netannyahu's true ideology?
",2024-10-11 03:50:46,0,20,"I don't think Netanyahu is a full-on religious nationalist like his coalition members, and his settlement policy is mainly due to political interest. Where would it be if you had to put Netanyahu in the political spectrum? I always thought he is a moderate, but he needed to appease his extreme partners. 

In the past, he supported a 2 state solution in Bar Ilan speech

[https://www.gov.il/en/pages/address-by-pm-netanyahu-at-bar-ilan-university-14-jun-2009](https://www.gov.il/en/pages/address-by-pm-netanyahu-at-bar-ilan-university-14-jun-2009)

He agreed to John Kerry's framework in 2014

[https://www.timesofisrael.com/netanyahu-okayed-us-draft-setting-67-lines-as-start-for-talks-report/](https://www.timesofisrael.com/netanyahu-okayed-us-draft-setting-67-lines-as-start-for-talks-report/)

He made concessions to the Palestinians in 2015

[https://www.ynetnews.com/articles/0,7340,L-4634075,00.html](https://www.ynetnews.com/articles/0,7340,L-4634075,00.html)

He halted settlement construction in 2010, which Hilary Clinton praised

[https://www.ynetnews.com/articles/0,7340,L-3985091,00.html](https://www.ynetnews.com/articles/0,7340,L-3985091,00.html)

From 2010 to 2015 he built fewer settlements than his Olmert, Barak, Sharon

[https://www.ynetnews.com/articles/0,7340,L-4713814,00.html](https://www.ynetnews.com/articles/0,7340,L-4713814,00.html) 

I don't think he is anti-LBGT and he is secular.

In the other hand, he claims to support settlements, even before his trial he had ties with Conservative Republicans, and rejected a Palestinian state.  

So who is Netanyahu? A hardline Conservative idealist who believes in settlements and will never agree to a 2 state solution? Or a moderate who will make concessions under the right circumstances, but needs extremists to escape jail? 

",PoliticalDiscussion,0.35,2024-10-11,benjamin netannyahu's true ideology?
1g1djfx,Do wealth taxes really work or is it just a good campaign slogan that never gets enacted?,2024-10-11 12:14:07,10,187,"Wealth taxes have been proposed as a way to make the wealthy pay their fair share, however, anecdotal data out of Norway has shown that many ultra wealthy left the country and tax revenue actually declined. Are wealth taxes a good talking point for an election but have little viability since the ultra wealthy have the flexibility to move to a lower tax jurisdiction?",PoliticalDiscussion,0.44999999999999996,2024-10-11,wealth taxes really work good campaign slogan never gets enacted?
1g1ikrn,What are your thoughts on the quiet Trump voter?,2024-10-11 15:56:43,280,515,"The idea is that many people secretly vote for Trump but won't admit or discuss it with others (including pollsters) because they are afraid of being harassed or attacked. 

TL;DR anecdotal ""evidence"" incoming so take this for the grain of salt it's worth:

I live on a *light* blue island in the middle of a deep red state.  In 2016, there were almost zero Trump signs and his hardocre supporters seemed very much the random kooky outlier types.  However, if you had conservative friends (of which I have many) and you were someone they didn't fear judgement from, they would usually quietly say tell you they were voting for him over Clinton. To me at least, this seems to represent the classic ""silent"" Trump supporters.

Fast forward to now and -at least in my suburban/rural part of the world- it seems as if the tables are totally flipped; people who support Harris keep their political views more to themselves or their social media echospheres largely because they're afraid of the (possibly violent) response they may elicit. At the same time, pro-Trump & anti-liberal bumper stickers, yard signs, and flags pepper T-shirts, vehicles, and front yards.

Is it different in large cities or other parts of the country? Do Trump supporters still tend to be more politically private? Or is that concept a thing of past?",PoliticalDiscussion,0.0,2024-10-11,thoughts quiet trump voter?
1g10b9x,What were some (non-polling) warning signs that emerged for Clinton's campaign in the final weeks of the 2016 election? Are we seeing any of those same warning signs for Harris this year?,2024-10-10 23:04:28,361,680,"I see pundits occasionally refer to the fact that, despite Clinton leading in the polls, there were signs later on in the election season that she was on track to do poorly. Low voter enthusiasm, high number of undecideds, results in certain primaries, etc. But I also remember there being plenty of fanfare about early vote numbers and ballot returns showing positive signs that never materialized. In your opinion, what are some relevant warning signs that we saw in 2016, and are these factors any different for Harris this election?",PoliticalDiscussion,0.0,2024-10-10,(non-polling) warning signs emerged clinton's campaign final weeks 2016 election? seeing warning signs harris year?
1g0yidm,"With RCP polling averages now showing Trump pulling ahead in both Michigan and Penn, and the historical underrepresentation of Trump support in polling (both in 2016, and 2020). What does the Harris-Walz campaign need to do improve in Penn and Michigan to carry these states down the stretch?",2024-10-10 21:26:05,0,102,"I know RCP tend to include some less reputable pollsters, but given polls in 2016 and 2020 in these states overestimated democratic support, it would seem that recently Trump has at least pulled even in these states, if not pulled ahead slightly. I heard somewhere (perhaps the rest is politics US) that the Harris campaign is on par with the Clinton campaign of '16 in terms of the number of campaign events in October thus far, and 1/3rd less than the Obama campaign in 2012. Relative to the lead up to the DNC and the weeks afterwards, it certainly seems like the Harris campaign have let off the gas a bit, despite much more Harris interviews in recent days.

Is it just a case that Harris and Walz need to increase their event schedule in these states? Do they need stronger surrogacy support? Is the ground game lagging? Are there specific reasons we can identify why there is a regression towards Trump among likely voters in these two critical states?

[Michigan polls RCP](https://www.realclearpolling.com/polls/president/general/2024/michigan/trump-vs-harris), [Penn polls RCP](https://www.realclearpolling.com/polls/president/general/2024/pennsylvania/trump-vs-harris)",PoliticalDiscussion,-0.07777777777777778,2024-10-10,"rcp polling averages showing trump pulling ahead michigan penn, historical underrepresentation trump support polling (both 2016, 2020). harris-walz campaign need improve penn michigan carry states stretch?"
1g0jkf9,Get-out-the-vote operations,2024-10-10 10:03:59,9,5,"This is a tight election, particularly in the swing states. It's probably going to come down to voter enthusiasm and efforts to turn out voters. So do we know the state of the Democratic and Republican get-out-the-vote operations?",PoliticalDiscussion,0.0,2024-10-10,get-out-the-vote operations
1g0i210,"Can mail-in ballots lead to voter intimidation in the household, especially for women?",2024-10-10 08:50:53,8,54,"Ballots are secret so people can vote without fear or pressure. But if everyone in the family is filling out their ballot at the dinner table, will there be pressure (generally from men) for the other people in the household (their wives) to vote a certain way?",PoliticalDiscussion,0.0,2024-10-10,"mail-in ballots lead voter intimidation household, especially women?"
1g0h4xb,Should the 3 baltic countries become part of Russian federation? ,2024-10-10 08:01:04,0,51,There is a lot of fears of new war. Well from the Russian perspective they liberated these countries from the Nazi Germany. During Soviet union they have built and installed a lot of infrastructure. Also there are a lot of Russian speakers living there.Retaking these territories would be beneficial for Russia because of unfrozen shipping ports and direct access to their Kaliningrad region.Should Russia retake them? Or there would be a world war with US involved in order to keep Russia out?,PoliticalDiscussion,0.0,2024-10-10,3 baltic countries become part russian federation?
