id,title,created_utc,score,num_comments,selftext,subreddit,sentiment,date,cleaned_title
1gn0lr5,His Father Is Leaving Office. Is Hunter Biden’s Art Market Also Over?,2024-11-08 22:05:12,1,3,,politics,0.0,2024-11-08,father leaving office. hunter biden’s art market also over?
1gn0ksh,Pelosi blames Biden for election loss as finger pointing intensifies,2024-11-08 22:03:44,5,3,,politics,0.0,2024-11-08,pelosi blames biden election loss finger pointing intensifies
1gn0h7j,Democratic Congresswoman Marie Gluesenkamp Pérez wins re-election in Republican-leaning Washington 3rd District,2024-11-08 21:58:16,4,4,,politics,0.15,2024-11-08,democratic congresswoman marie gluesenkamp pérez wins re-election republican-leaning washington 3rd district
1gn0ame,"Elon Musk joined Trump-Zelensky call amid concerns for future of Ukraine war
",2024-11-08 21:48:01,11,25,,politics,0.0,2024-11-08,elon musk joined trump-zelensky call amid concerns future ukraine war
1gn09ww,Democrats Hoped the Bros Wouldn't Show. But They Did.,2024-11-08 21:46:55,0,29,,politics,0.0,2024-11-08,democrats hoped bros show. did.
1gmzyjd,‘Power grab’: Elon Musk sets stage to act as Trump’s ‘co-president’,2024-11-08 21:29:39,52,94,,politics,0.0,2024-11-08,‘power grab’: elon musk sets stage act trump’s ‘co-president’
1gmzrhc,J.D. Vance Was a Poster Boy for Yale Law School. The School Won’t Congratulate Him on His Victory.,2024-11-08 21:19:28,45,52,,politics,0.0,2024-11-08,j.d. vance poster boy yale law school. school won’t congratulate victory.
1gmzpiq,Top Moulton aide quits after transgender athlete remarks,2024-11-08 21:16:33,11,19,,politics,0.5,2024-11-08,top moulton aide quits transgender athlete remarks
1gmzoc9,Arizona Supreme Court Rejects Kari Lake’s Seventh Bid to Overturn 2022 Election Results,2024-11-08 21:14:51,66,3,,politics,0.0,2024-11-08,arizona supreme court rejects kari lake’s seventh bid overturn 2022 election results
1gmzkuh,RFK Jr. is crowdsourcing reams of nominees for Trump’s health administration,2024-11-08 21:09:43,7,12,,politics,0.0,2024-11-08,rfk jr. crowdsourcing reams nominees trump’s health administration
1gmzfgq,"After Trump wins the ‘influencer election’, why some Democrats want to create their own Joe Rogan",2024-11-08 21:01:47,0,81,,politics,0.44999999999999996,2024-11-08,"trump wins ‘influencer election’, democrats want create joe rogan"
1gmzdn3,DOJ sues Mississippi state Senate for paying Black staffer half the salary of white staffers,2024-11-08 20:59:21,40,11,,politics,-0.1111111111111111,2024-11-08,doj sues mississippi state senate paying black staffer half salary white staffers
1gmzbio,Nancy Pelosi says Biden’s delay in exiting race blew Democrats’ chances,2024-11-08 20:56:20,1,72,,politics,0.0,2024-11-08,nancy pelosi says biden’s delay exiting race blew democrats’ chances
1gmzazi,America Is Now the Divided Republic the Framers Feared (2020),2024-11-08 20:55:33,23,15,,politics,0.0,2024-11-08,america divided republic framers feared (2020)
1gmzaqa,Crisis Calls From LGBTQ+ Youth Spiked by 700 Percent After Election Day,2024-11-08 20:55:11,107,29,,politics,0.0,2024-11-08,crisis calls lgbtq+ youth spiked 700 percent election day
1gmz5io,AP Race Call: Democrat Andrea Salinas wins reelection to U.S. House in Oregon’s 6th Congressional District and gives Democrats their 200th seat in the house,2024-11-08 20:47:46,97,7,,politics,0.3,2024-11-08,ap race call: democrat andrea salinas wins reelection u.s. house oregon’s 6th congressional district gives democrats 200th seat house
1gmz22i,Jen Psaki Criticizes Democrats for Over-Listening and Over-Lifting Never Trumpers Instead Of Focusing On People Who Left The Democratic Party,2024-11-08 20:42:56,315,142,,politics,0.0,2024-11-08,jen psaki criticizes democrats over-listening over-lifting never trumpers instead focusing people left democratic party
1gmyvbj,FEMA Official Ordered Relief Workers To Skip Houses With Trump Signs,2024-11-08 20:33:16,0,94,,politics,0.0,2024-11-08,fema official ordered relief workers skip houses trump signs
1gmypit,Seth Moulton’s comments on trans athletes spark criticism as Democrats play blame game over loss,2024-11-08 20:25:07,0,29,,politics,-0.4,2024-11-08,seth moulton’s comments trans athletes spark criticism democrats play blame game loss
1gmyjxc,5 numbers that help explain why Donald Trump won Michigan,2024-11-08 20:17:29,0,38,,politics,0.0,2024-11-08,5 numbers help explain donald trump michigan
1gmygjb,What Trump Can Do to Workers’ Biden-Era Gains,2024-11-08 20:12:46,0,14,,politics,0.0,2024-11-08,trump workers’ biden-era gains
1gmy99j,"Kamala Harris has surpassed the vote total of Barack Obama's first term which stood at 69,498,516.  She now has the fourth most votes ever tallied by a candidate for U.S. President.",2024-11-08 20:02:28,54,88,,politics,0.1875,2024-11-08,"kamala harris surpassed vote total barack obama's first term stood 69,498,516. fourth votes ever tallied candidate u.s. president."
1gmy96i,The digital divide for Indian Country got better under Biden—will that progress go away?,2024-11-08 20:02:21,9,6,,politics,0.25,2024-11-08,digital divide indian country got better biden—will progress go away?
1gmy3y6,Biden’s internal polling showed Trump getting 400 electoral votes,2024-11-08 19:55:15,78,162,,politics,0.0,2024-11-08,biden’s internal polling showed trump getting 400 electoral votes
1gmxuf8,Democrats join 2024’s graveyard of incumbents,2024-11-08 19:41:56,8,14,,politics,0.0,2024-11-08,democrats join 2024’s graveyard incumbents
1gmxpy8,"Despite concerns about ACA and reproductive rights, health care was not a voting issue: Experts",2024-11-08 19:35:33,39,35,,politics,0.0,2024-11-08,"despite concerns aca reproductive rights, health care voting issue: experts"
1gmxour,"Stock Market, Bonds, and Crypto sky rocket in response to Trump’s Election",2024-11-08 19:34:05,0,47,,politics,0.0,2024-11-08,"stock market, bonds, crypto sky rocket response trump’s election"
1gmxoqz,Why Trump’s threats of mass deportation appealed to some Latino voters,2024-11-08 19:33:57,36,102,,politics,0.0,2024-11-08,trump’s threats mass deportation appealed latino voters
1gmxmcg,MAGA Christians eager to shatter bedrock principle of American democracy,2024-11-08 19:30:35,92,71,,politics,0.0,2024-11-08,maga christians eager shatter bedrock principle american democracy
1gmxlhp,"Trump would ‘absolutely’ scrap Biden’s Air Force One colors, adviser says",2024-11-08 19:29:31,3,17,,politics,0.2,2024-11-08,"trump would ‘absolutely’ scrap biden’s air force one colors, adviser says"
1gmxl5j,Justice Department brings criminal charges in Iranian murder-for-hire plan targeting Donald Trump,2024-11-08 19:29:03,7,9,,politics,-0.4,2024-11-08,justice department brings criminal charges iranian murder-for-hire plan targeting donald trump
1gmxhiy,Rep. Jared Moskowitz says he was target of potential assassination plot ,2024-11-08 19:24:07,24,7,,politics,0.0,2024-11-08,rep. jared moskowitz says target potential assassination plot
1gmxgzv,Handmaid’s Tale soars 400 places to third place on bestseller charts after Trump win,2024-11-08 19:23:22,1079,95,,politics,0.4,2024-11-08,handmaid’s tale soars 400 places third place bestseller charts trump win
1gmxf1s,Gavin Newsom’s quest to ‘Trump-proof’ California enrages incoming president,2024-11-08 19:20:48,9502,1344,,politics,0.0,2024-11-08,gavin newsom’s quest ‘trump-proof’ california enrages incoming president
1gmxenh,Trump may deport hundreds of thousands of migrants whom Biden allowed to legally enter U.S.,2024-11-08 19:20:17,76,59,,politics,0.2,2024-11-08,trump may deport hundreds thousands migrants biden allowed legally enter u.s.
1gmxba0,Jan. 6 rioter targeted by 'fedsurrection' conspiracy theories gets 8 years in prison,2024-11-08 19:15:57,90,26,,politics,0.0,2024-11-08,jan. 6 rioter targeted 'fedsurrection' conspiracy theories gets 8 years prison
1gmxac0,"Biden-Harris Administration Marks Major Milestones for Offshore Wind, Approves Tenth Project | U.S. Department of the Interior",2024-11-08 19:14:45,33,13,,politics,0.0625,2024-11-08,"biden-harris administration marks major milestones offshore wind, approves tenth project u.s. department interior"
1gmx8rl,ChatGPT told 2M people to get their election news elsewhere — and rejected 250K deepfakes | TechCrunch,2024-11-08 19:12:32,28,7,,politics,0.0,2024-11-08,chatgpt told 2m people get election news elsewhere — rejected 250k deepfakes techcrunch
1gmx817,"With Trump Tariffs Looming, Businesses Try to ‘Run From a Moving Target’ ",2024-11-08 19:11:33,38,27,,politics,0.0,2024-11-08,"trump tariffs looming, businesses try ‘run moving target’"
1gmx6qg,We need to make a public registry for j6rs. They don’t get to live happily ever after ,2024-11-08 19:09:45,482,84,,politics,0.31212121212121213,2024-11-08,need make public registry j6rs. don’t get live happily ever
1gmx5rn,"Congress could try barring Trump from office under 14th Amendment, but it likely won’t",2024-11-08 19:08:25,33,48,,politics,0.0,2024-11-08,"congress could try barring trump office 14th amendment, likely won’t"
1gmwxgj,Black people are receiving racist text messages about picking cotton 'at the nearest plantation',2024-11-08 18:58:03,5,40,,politics,-0.16666666666666666,2024-11-08,black people receiving racist text messages picking cotton 'at nearest plantation'
1gmwsfn,FEMA Official Ordered Relief Workers To Skip Houses With Trump Signs,2024-11-08 18:51:40,0,112,,politics,0.0,2024-11-08,fema official ordered relief workers skip houses trump signs
1gmwrw0,From January: “Trump Can’t Be Dictator on ‘Day One’ — Or in a Second Term. Here’s Why.”,2024-11-08 18:50:55,0,72,,politics,0.0,2024-11-08,january: “trump can’t dictator ‘day one’ — second term. here’s why.”
1gmwq1n,Fetterman says ‘bros’ are Democrats’ ‘childless cat ladies’,2024-11-08 18:48:31,0,77,,politics,0.0,2024-11-08,fetterman says ‘bros’ democrats’ ‘childless cat ladies’
1gmwmav,Pelosi says Biden should have dropped out earlier so there could be a primary: 'It would have been different',2024-11-08 18:43:39,28,115,,politics,0.13333333333333333,2024-11-08,pelosi says biden dropped earlier could primary: 'it would different'
1gmwf7r,"After Trump's Victory, the 4B Movement Is Spreading Across TikTok",2024-11-08 18:34:13,82,211,,politics,0.0,2024-11-08,"trump's victory, 4b movement spreading across tiktok"
1gmwdq2,Racist Trolls Celebrated the Election By Texting Black Voters to “Pick Cotton”,2024-11-08 18:32:21,30,40,,politics,0.09166666666666666,2024-11-08,racist trolls celebrated election texting black voters “pick cotton”
1gmwcc8,Trump-Musk bromance is a love that can’t last,2024-11-08 18:30:31,119,34,,politics,0.25,2024-11-08,trump-musk bromance love can’t last
1gmwbjd,Judge in Trump's 'hush money' trial considers tossing felony conviction,2024-11-08 18:29:31,0,45,,politics,0.0,2024-11-08,judge trump's 'hush money' trial considers tossing felony conviction
1gmwaif,Opinion: I guess Trump won because Democrats forgot to cheat. Oops!,2024-11-08 18:28:15,0,27,,politics,0.0,2024-11-08,opinion: guess trump democrats forgot cheat. oops!
1gmw9e1,"Donald Trump’s lawyers will seek to end Georgia election meddling case, citing presidential protections",2024-11-08 18:26:49,48,20,,politics,0.0,2024-11-08,"donald trump’s lawyers seek end georgia election meddling case, citing presidential protections"
1gmw99b,"US judge tosses Illinois' ban on semiautomatic weapons, governor pledges swift appeal",2024-11-08 18:26:38,35,34,,politics,0.0,2024-11-08,"us judge tosses illinois' ban semiautomatic weapons, governor pledges swift appeal"
1gmw4mz,"Exit Right. Trump has remade Americans, and to defeat Trumpism requires nothing less than the left doing the same.",2024-11-08 18:20:42,91,201,,politics,0.02976190476190476,2024-11-08,"exit right. trump remade americans, defeat trumpism requires nothing less left same."
1gmw2it,"AP Race Call: Republican Don Bacon wins reelection to U.S. House in Nebraska's 2nd Congressional District, gibing republicans their 212th house seat.",2024-11-08 18:17:57,6,9,,politics,0.15,2024-11-08,"ap race call: republican bacon wins reelection u.s. house nebraska's 2nd congressional district, gibing republicans 212th house seat."
1gmvx24,Jenniffer González of Puerto Rico's pro-statehood party edges ahead in gubernatorial election,2024-11-08 18:10:53,29,4,,politics,0.0,2024-11-08,jenniffer gonzález puerto rico's pro-statehood party edges ahead gubernatorial election
1gmvumi,It’s Time for a Bluexit  — A declaration of independence from Trump's America.,2024-11-08 18:07:41,0,107,,politics,0.0,2024-11-08,it’s time bluexit — declaration independence trump's america.
1gmvubq,"Why Latino men voted for Trump: 'It's the economy, stupid'",2024-11-08 18:07:19,0,132,,politics,-0.7999999999999999,2024-11-08,"latino men voted trump: 'it's economy, stupid'"
1gmvpya,Stephen A. Smith Claps at Oprah and Michelle Obama Over Kamala's Election Loss,2024-11-08 18:01:41,0,12,,politics,0.0,2024-11-08,stephen a. smith claps oprah michelle obama kamala's election loss
1gmvpte,10 Takeaways from the 2024 Election in Wisconsin,2024-11-08 18:01:32,7,2,,politics,0.0,2024-11-08,10 takeaways 2024 election wisconsin
1gmvlek,"Kamala Harris Was A Terrible Candidate, And Democrats Need To Be Honest About That",2024-11-08 17:56:18,0,157,,politics,-0.2,2024-11-08,"kamala harris terrible candidate, democrats need honest"
1gmvlda,Map shows Trump's 2024 election victory came as voters shifted red across the country,2024-11-08 17:56:15,0,46,,politics,0.0,2024-11-08,map shows trump's 2024 election victory came voters shifted red across country
1gmvkv9,U.S. will send contractors to Ukraine to help fix its weapons ,2024-11-08 17:55:34,34,17,,politics,0.0,2024-11-08,u.s. send contractors ukraine help fix weapons
1gmvgji,Why Susie Wiles Is So Good at Managing Donald Trump,2024-11-08 17:49:50,0,39,,politics,0.7,2024-11-08,susie wiles good managing donald trump
1gmvg5j,Former Obama adviser: Democrats must realize ‘our democracy’ angers voters,2024-11-08 17:49:18,18,43,,politics,0.0,2024-11-08,former obama adviser: democrats must realize ‘our democracy’ angers voters
1gmvdj0,Dem Insiders Begged Team Harris Not to Campaign with Liz Cheney,2024-11-08 17:45:58,336,271,,politics,0.0,2024-11-08,dem insiders begged team harris campaign liz cheney
1gmvc60,Hill Democrats say their warnings about the party’s shortfalls on the border were ignored,2024-11-08 17:44:20,6,41,,politics,0.0,2024-11-08,hill democrats say warnings party’s shortfalls border ignored
1gmvc3x,"Despite reforms, New York faces childcare cost crisis",2024-11-08 17:44:17,5,6,,politics,0.13636363636363635,2024-11-08,"despite reforms, new york faces childcare cost crisis"
1gmvazt,The National Security Imperative for a Trump Presidency,2024-11-08 17:42:52,0,7,,politics,0.0,2024-11-08,national security imperative trump presidency
1gmva4d,The Biden-Harris Lowering Costs Agenda,2024-11-08 17:41:48,24,45,,politics,0.0,2024-11-08,biden-harris lowering costs agenda
1gmv9h7,Trump AG Prospect Warns Letitia James: 'We Will Put Your Fat Ass In Prison',2024-11-08 17:40:59,218,94,,politics,0.0,2024-11-08,trump ag prospect warns letitia james: 'we put fat ass prison'
1gmuy1p,"Why Does No One
Understand the Real Reason Trump Won?",2024-11-08 17:27:01,0,174,,politics,0.2,2024-11-08,one understand real reason trump won?
1gmuwpi,Trump Allies Suddenly Feel Safe Touting Project 2025,2024-11-08 17:25:19,454,102,,politics,0.25,2024-11-08,trump allies suddenly feel safe touting project 2025
1gmuwfp,Trump's tariffs would drive up consumer prices: National Retail Federation,2024-11-08 17:24:59,280,66,,politics,0.0,2024-11-08,trump's tariffs would drive consumer prices: national retail federation
1gmutty,Executive Actions Biden Could Take,2024-11-08 17:21:43,7,44,,politics,0.0,2024-11-08,executive actions biden could take
1gmurer,What is the point of polling?,2024-11-08 17:18:47,18,32,,politics,0.0,2024-11-08,point polling?
1gmun19,Regarding the Elimination of U.S. Department of Education,2024-11-08 17:13:19,29,22,,politics,0.0,2024-11-08,regarding elimination u.s. department education
1gmuhbs,The Democrats Are Playing the Blame Game. Leave Trans Kids Out Of It,2024-11-08 17:06:17,0,78,,politics,-0.4,2024-11-08,democrats playing blame game. leave trans kids
1gmuab9,The final price tag on 2024 political advertising: Almost $11 billion,2024-11-08 16:57:56,53,21,,politics,0.0,2024-11-08,final price tag 2024 political advertising: almost $11 billion
1gmu9si,"Giridharadas: Joe Rogan Is Recruiting Men to Fascism — We Need a ‘Feminist’ Version
",2024-11-08 16:57:15,0,59,,politics,0.0,2024-11-08,giridharadas: joe rogan recruiting men fascism — need ‘feminist’ version
1gmu9sf,Western States Are Still Counting Ballots.  Here's Why That Matters.,2024-11-08 16:57:15,44,18,,politics,0.0,2024-11-08,western states still counting ballots. here's matters.
1gmu9cy,Kamala Harris’ campaign didn’t ignore working class voters,2024-11-08 16:56:43,3743,2130,,politics,0.0,2024-11-08,kamala harris’ campaign didn’t ignore working class voters
1gmu98v,"The Haitians of Springfield, a Trump campaign target, brace for his presidency",2024-11-08 16:56:36,60,16,,politics,0.0,2024-11-08,"haitians springfield, trump campaign target, brace presidency"
1gmu89k,Election glitch throws outcome of Michigan House race into dispute,2024-11-08 16:55:20,70,12,,politics,0.0,2024-11-08,election glitch throws outcome michigan house race dispute
1gmu3xb,"Fed cuts interest rates heading into end of Biden White House and looking to Trump’s 2nd term
",2024-11-08 16:50:08,23,10,,politics,0.0,2024-11-08,fed cuts interest rates heading end biden white house looking trump’s 2nd term
1gmu3kw,Democrats would get nothing for throwing trans Americans under the bus,2024-11-08 16:49:43,0,68,,politics,0.0,2024-11-08,democrats would get nothing throwing trans americans bus
1gmu00f,"All four incumbent University of Nebraska regents maintain leads in Tuesday election
",2024-11-08 16:45:20,0,1,,politics,0.0,2024-11-08,four incumbent university nebraska regents maintain leads tuesday election
1gmtylf,Democratic governors vow to protect their states from Trump and his policies,2024-11-08 16:43:35,200,45,,politics,0.0,2024-11-08,democratic governors vow protect states trump policies
1gmty4y,Trump Accuses Newsom of Attempt to 'Trump-Proof' Calif.,2024-11-08 16:43:02,0,54,,politics,0.0,2024-11-08,trump accuses newsom attempt 'trump-proof' calif.
1gmtsrf,How to navigate political discussions,2024-11-08 16:36:18,0,27,,politics,0.0,2024-11-08,navigate political discussions
1gmtpg3,Trump will name more conservative judges. He may even pick a majority of the Supreme Court.,2024-11-08 16:32:26,122,52,,politics,0.5,2024-11-08,trump name conservative judges. may even pick majority supreme court.
1gmtkg3,Pelosi blames Harris' loss on Biden's late exit and no open Democratic primary,2024-11-08 16:26:15,126,184,,politics,0.03333333333333335,2024-11-08,pelosi blames harris' loss biden's late exit open democratic primary
1gmtka6,I Study Guys Like Trump. There’s a Reason They Keep Winning. | NYTimes gift articles,2024-11-08 16:26:03,0,30,,politics,0.5,2024-11-08,study guys like trump. there’s reason keep winning. nytimes gift articles
1gmthbi,Rubio in Mix for Secretary of State as Trump Looks to Florida Allies,2024-11-08 16:22:21,0,4,,politics,0.0,2024-11-08,rubio mix secretary state trump looks florida allies
1gmtgt9,Trump names first-ever female as White House chief of staff,2024-11-08 16:21:42,0,26,,politics,0.0,2024-11-08,trump names first-ever female white house chief staff
1gmtgll,"Despite pressure on Sotomayor, Supreme Court unlikely to change before Trump takes office. Here's why.",2024-11-08 16:21:25,11,15,,politics,-0.5,2024-11-08,"despite pressure sotomayor, supreme court unlikely change trump takes office. here's why."
1gmtfre,"""I vote against my economic interests pretty much every time, but apparently in an approved way.""",2024-11-08 16:20:28,0,3,,politics,0.17500000000000002,2024-11-08,"""i vote economic interests pretty much every time, apparently approved way."""
1gmt464,Who will be Donald Trump's White House press secretary? Seven Contenders,2024-11-08 16:06:43,0,27,,politics,0.0,2024-11-08,donald trump's white house press secretary? seven contenders
1gmt2vb,Americans stockpile abortion pills and hormones ahead of ‘reproductive apocalypse’ under Trump,2024-11-08 16:05:04,1717,282,,politics,0.0,2024-11-08,americans stockpile abortion pills hormones ahead ‘reproductive apocalypse’ trump
1gmsx2n,Highlights from President-elect Donald Trump’s first term as president of the United States,2024-11-08 15:58:17,0,26,,politics,0.25,2024-11-08,highlights president-elect donald trump’s first term president united states
1gmsv0t,Judge Grants Jack Smith’s Request for Pause in Jan. 6 Case After Trump’s Election,2024-11-08 15:55:52,99,30,,politics,0.0,2024-11-08,judge grants jack smith’s request pause jan. 6 case trump’s election
1gmsutb,What will happen to Tim Walz after Donald Trump's presidential election win?,2024-11-08 15:55:36,161,325,,politics,0.8,2024-11-08,happen tim walz donald trump's presidential election win?
1gmsuot,Election fraud? Claims disappear after Trump victory,2024-11-08 15:55:27,259,64,,politics,0.0,2024-11-08,election fraud? claims disappear trump victory
1gmsthm,Democratic governors vow to protect their states from Trump and his policies,2024-11-08 15:54:00,741,102,,politics,0.0,2024-11-08,democratic governors vow protect states trump policies
1gmssx7,The Trump Ukraine Victory Fund: A Proposal,2024-11-08 15:53:17,0,5,,politics,0.0,2024-11-08,trump ukraine victory fund: proposal
1gmss77,"Scott Presler, and Amos Miller. Two large pivot points in the Amish Vote in PA. ",2024-11-08 15:52:26,0,10,,politics,0.21428571428571427,2024-11-08,"scott presler, amos miller. two large pivot points amish vote pa."
1gmsrby,Trump Has Already Broken First Election Promise,2024-11-08 15:51:25,1087,375,,politics,-0.07500000000000001,2024-11-08,trump already broken first election promise
1gmspn1,Pentagon officials discussing how to respond if Trump issues controversial orders,2024-11-08 15:49:28,204,84,,politics,0.55,2024-11-08,pentagon officials discussing respond trump issues controversial orders
1gmslnc,"Iranian Agents Plotted to Kill Trump, U.S. Says in Unsealed Charges",2024-11-08 15:44:40,43,19,,politics,0.0,2024-11-08,"iranian agents plotted kill trump, u.s. says unsealed charges"
1gmsfal,Judge cancels court deadlines in Trump's 2020 election case after his presidential win,2024-11-08 15:37:02,22,15,,politics,0.8,2024-11-08,judge cancels court deadlines trump's 2020 election case presidential win
1gmse3h,Biden administration to allow American military contractors to deploy to Ukraine for first time since Russia’s invasion,2024-11-08 15:35:34,194,88,,politics,0.049999999999999996,2024-11-08,biden administration allow american military contractors deploy ukraine first time since russia’s invasion
1gms5kz,"Pelosi Laments Biden’s Late Exit and the Lack of an ‘Open Primary’ | “Had the president gotten out sooner, there may have been other candidates in the race,” the former House speaker said in an interview with The New York Times, suggesting she had anticipated an “open primary.”",2024-11-08 15:25:29,454,466,,politics,0.06392045454545456,2024-11-08,"pelosi laments biden’s late exit lack ‘open primary’ “had president gotten sooner, may candidates race,” former house speaker said interview new york times, suggesting anticipated “open primary.”"
1gms2ip,"Leftist Women Shave Their Heads in Protest of Trump Victory: ‘F**k Being Hot,’ That’s What the ‘Patriarchy’ Wants",2024-11-08 15:21:48,0,60,,politics,0.13333333333333333,2024-11-08,"leftist women shave heads protest trump victory: ‘f**k hot,’ that’s ‘patriarchy’ wants"
1gmrzcl,Texas Democratic Party chair steps down after brutal election beating,2024-11-08 15:18:02,68,37,,politics,-0.5152777777777777,2024-11-08,texas democratic party chair steps brutal election beating
1gmrt7v,Democrats in frantic talks to push out most liberal Supreme Court justice,2024-11-08 15:10:33,76,108,,politics,0.5,2024-11-08,democrats frantic talks push liberal supreme court justice
1gmrrps,Top Trump prosecutor cancels remaining court dates,2024-11-08 15:08:47,74,56,,politics,0.5,2024-11-08,top trump prosecutor cancels remaining court dates
1gmrqtq,California Shifts Rightward on Crime in an Election Fueled by Frustration,2024-11-08 15:07:43,27,49,,politics,0.0,2024-11-08,california shifts rightward crime election fueled frustration
1gmronb,Welcome to the era of Donald Trump versus Taylor Swift,2024-11-08 15:05:08,0,38,,politics,0.8,2024-11-08,welcome era donald trump versus taylor swift
1gmrne6,"Racist texts about slaves and ‘picking cotton’ sent to Black people as state AGs, colleges and police probe their origins",2024-11-08 15:03:40,78,28,,politics,-0.16666666666666666,2024-11-08,"racist texts slaves ‘picking cotton’ sent black people state ags, colleges police probe origins"
1gmrn5q,'We'll Fight to the Death': Democratic Governors Plan War Against Trump,2024-11-08 15:03:23,0,36,,politics,0.0,2024-11-08,'we'll fight death': democratic governors plan war trump
1gmrhpe,"The US election was largely trouble-free, but a flood of misinformation raises future concerns",2024-11-08 14:57:09,62,25,,politics,0.10714285714285714,2024-11-08,"us election largely trouble-free, flood misinformation raises future concerns"
1gmrg7s,Trump tears into Newsom over special legislative session,2024-11-08 14:55:18,0,53,,politics,0.35714285714285715,2024-11-08,trump tears newsom special legislative session
