id,title,created_utc,score,num_comments,selftext,subreddit,sentiment,date,cleaned_title
1gjve6i,If Harris wins will she and/or her administration change the laws surrounding being president? ,2024-11-04 20:39:06,20,95,"For example, the president is not required to put their assets in an irrevocable trust. A president is not required to provide financial statements. A candidate or president isn't really required to do anything because in the past candidates and presidents were assumed to be above board individuals. We've never had a president selling merch. Or having a hotel that sold rooms to foreign diplomats. 

Should Harris and Democrats change all of this while they have the chance? ",PoliticalDiscussion,0.3,2024-11-04,harris wins and/or administration change laws surrounding president?
1gjw1uo,"What does Donald Trump do if he loses the election tomorrow, what happens to Trumpism? ",2024-11-04 21:11:41,532,796,"Donald Trump has reshaped the Republican Party over the last decade. Considered a long shot in 2016, he now has an ironclad rule over the party. 

Anyone that he calls a “Rino” is instantly ostracized from the party. It doesn’t matter how long they’ve been a Republican or how conservative their votes were. Liz Cheney and Adam Kizinger learned this first hand. From John Kasich, to Michael Steel, Bill Barr to literally Mitch McConnell, the list of booted Republicans is endless. 

So what happens when someone who has such a hold on the party loses 4 elections in a row - 2018, 2020, 2022 and now possibly 2024? 

It’s not like all of his political power will evaporate overnight. He’ll still have a tight grasp on the base, who frankly don’t seem bothered that they’re losing so many elections, as long as they get their entertainment rallies. 

What happens to Donald Trump if he loses tomorrow night? If he continues to keep his political power, is the party happy with losing elections forever? If he loses his influence and power, then who takes up in that vacuum? ",PoliticalDiscussion,-0.3,2024-11-04,"donald trump loses election tomorrow, happens trumpism?"
1gjvxi3,What happens to MAGA if Trump wins? ,2024-11-04 21:05:36,0,39,He is going to die. All of us die in the end. What happens to the MAGAM movement after the election if he wins. Does the torch pass to his pick? Does MAGA pick a new leader? Do we get to keep democracy? Do we learn we all over reacted to it all?,PoliticalDiscussion,0.3,2024-11-04,happens maga trump wins?
1gjsu6z,What was political discourse about the twenty-seventh amendment like at the time of its ratification in 1992?,2024-11-04 18:39:14,30,15,"I've never met someone whose favorite constitutional amendment is the twenty-seventh, but if I did, I wouldn't trust them. 

Anyway, whenever I'd learn about the Constitution and its amendments in school, my teachers always glossed over the twenty-seventh amendment and didn't really talk about it. The twenty-seventh, and most recent amendment, deals with congressional salaries. Not as exciting as women's suffrage or abolishing slavery. But I wasn't around in the early 90s. I don't know what people thought of it. Did people care? Has the discourse or opinion changed compared to back then? ",PoliticalDiscussion,0.0,2024-11-04,political discourse twenty-seventh amendment like time ratification 1992?
1gjmvys,What would happen if a substantial number of votes in a critical state were destroyed?,2024-11-04 14:29:00,21,16,"What would happen if, during the election tomorrow, a substantial number of votes were destroyed in a swing state? For example, say that lightning strikes a polling place in Pennsylvania, starts a fire, and 10,000 ballots and the ballot tabulators are all destroyed. What would happen? The election is potentially close enough that those 10,000 votes could decide not only who wins the state, but the whole election. 

Just counting all of the other votes and ignoring those that burned seems like a terrible idea, and would seem to encourage bad actors to try to destroy ballots in areas of states where their opponent is likely to get a lot of votes. But allowing the voters in that precinct to vote again after the main election is over seems like a massive can of worms. Are there any laws covering this sort of (admittedly unlikely) scenario?",PoliticalDiscussion,0.0,2024-11-04,would happen substantial number votes critical state destroyed?
1gjh6va,What should Kamala say to get support from Arab Americans while also not lose too much support from other groups?,2024-11-04 10:39:05,0,32,"It seems Kamala has to thread a needle.  She's losing the Arab American vote by not coming down harder on Israel, but if she does come down harder on Israel she might lose other groups of voters.  What do you think is the right messaging for her to bring back Arab Americans without resulting in a larger loss that will lose her the election?  Is this possible?  Or maybe you think coming down harder on Israel wouldn't cost her other supporters?  I know this is a super controversial topic.  Please be respectful to Arab Americans and other voters.",PoliticalDiscussion,0.037500000000000006,2024-11-04,kamala say get support arab americans also lose much support groups?
1gjog1j,What're The Most Interesting House Races Going On Right Now?,2024-11-04 15:32:39,65,51,"Everyone's talking about the President. The Senate is getting less press but people are still paying close attention to Montana, Ohio and, to a lesser extent, Texas and Nebraska. But what about the House? I haven't heard anything about any true swing districts, changing political landscapes, notable congressmen being given serious fights or which ones might be belwethers for the future. Are there any that are worth taking a peek at or is everyone just going to be riding the coattails of the President race?",PoliticalDiscussion,0.42857142857142855,2024-11-04,what're interesting house races going right now?
1gjqw99,PBS has released its final [NPR/Marist] election poll giving Harris a 4% [51-47] lead among likely voters. The 2020 election was also 51 to 47 percent.  Just hours from election day does this data have some predictive value in assessing electoral college map? ,2024-11-04 17:13:29,507,284,"Trump still leads among men, but it has shrunk to 4 points, down from the 16-point advantage he had over Harris in October. At the same time, 55% of women say they will back Harris in the latest survey. The vice president’s lead among women has shrunk from 18 points to 11 points since last month.

A little more than half of independents support the Republican nominee, a 5-point lead over Harris.

Trump leads Harris 54 percent to 45 percent among white voters, but her 9-point deficit is a slight improvement over the 12-point advantage Trump had with this group in 2020.

Harris instead has seen some erosion among Black and Latino voters, who together made up about 20 percent of the vote in 2020. Harris has support from 83 percent of likely Black voters and 61 percent of likely Latino voters – down 8 and 2 points, respectively, from the share that supported Biden in 2020.

Eight percent of Republicans say they will vote for Harris, up 3 points from a month ago and double the number of Democrats who say they will back Trump.

More than 78 million ballots have already been cast, according to the University of Florida Election Lab. Fifty-five percent of likely voters in this poll report already having cast a ballot. One-third of voters say they plan to vote in person on Election Day, including 40 percent of Trump supporters.

Among those who have already voted, Harris leads Trump 56 percent to 42 percent. But with voters who have yet to cast ballots, 53 percent plan to vote for Trump; while 45 percent support Harris.

Just hours from election day does this data have some predictive value in assessing electoral college map? 

",PoliticalDiscussion,0.0,2024-11-04,pbs released final [npr/marist] election poll giving harris 4% [51-47] lead among likely voters. 2020 election also 51 47 percent. hours election day data predictive value assessing electoral college map?
1gjoez8,"In a popular vote election, how would campaigns change?",2024-11-04 15:31:22,54,98,"There have been discussions about campaign strategies as it relates to states candidates choose to visit - Is Trump wasting time in Virginia and New Mexico? Does sending JD Vance to New Hampshire mean they see an opening? Should Harris have visited New Hampshire and Iowa instead of Texas?

But if every vote in every state counts equally, how does the campaign landscape change? Is all media bought nationally? Does a candidate try to visit all 50 states? Or focus on bellwether counties in all states? Does a bus tour of Pennsylvania need to become a bus tour from coast to coast?",PoliticalDiscussion,0.6,2024-11-04,"popular vote election, would campaigns change?"
1gjc1sn,"The state of Washington, Oregon, and Nevada have mobilized their National Guard contingents to address election unrest. Is this a wise move and how effective will it be?",2024-11-04 06:30:16,82,49,"Source: https://www.cnn.com/2024/11/02/us/washington-oregon-nevada-national-guard-election/index.html

Of the three, only Nevada is a swing state. Oregon has already experience ballot box burnings. I'm not aware of any similar events in Washington.

At the same time, political supporters in North Carolina have said 'they are locked and loaded' in the event that the election is stolen

https://www.theguardian.com/us-news/2024/nov/03/trump-supporters-election-results

My question then is whether National Guard mobilization is justified. If so, where in the country should the National Guard be mobilized and where not? How effective or ineffective will National Guard mobilizations be on or after election day?",PoliticalDiscussion,0.6499999999999999,2024-11-04,"state washington, oregon, nevada mobilized national guard contingents address election unrest. wise move effective be?"
1gjeaqa,Will Jeffrey Epstein saying Trump was his best friend for a decade turn off undecided voters?,2024-11-04 08:32:22,1,1,"Donald Trump's friendship with Epstein, the most notorious pedophile in the world, has been known for a while. Recently however someone has unveiled 10 hours of never before heard tape of Epstein talking, in which he notably calls Trump his best friend for 10 years. With all the controversies happening, will this cut through the noise at all? Is it possible that while it won't reach that many people, it will turn off the ones who do hear it because it's so radioactive?",PoliticalDiscussion,1.0,2024-11-04,jeffrey epstein saying trump best friend decade turn undecided voters?
1gjdna1,What was the plan for James Baker if George HW Bush had won in 1992?,2024-11-04 08:00:44,1,1,"James Baker was Secretary of State under George HW Bush when all of a sudden he left the State Department in 1992 to become White House Chief of Staff and run Bush's unsuccessful reelection campaign.

I was very young when that happened and I thought at the time that it was abrupt for him to leave the State Department like that.

So I have been wondering for a long time what the plan was for Baker had Bush won.

Was Baker going to remain as White House Chief of Staff or was he going to return to the State Department with Lawrence Eagleburger being offered an ambassadorship or something?",PoliticalDiscussion,0.0,2024-11-04,plan james baker george hw bush 1992?
1gj71a0,"In 2 days the question will be answered; are the polls underestimating Dems as they have done since the Dobbs decision or are they underestimating Repubs as they have done every time Trump was on the ballot ""2016 & 2020"". Which do you think will happen & what argument supports your position?",2024-11-04 00:19:21,383,627,"According to the New York Times; most polls today weigh their results by the 2020 election results tipping the scales in favor of Trump so as to avoid what happened 2016 and 2020 when Trump was underestimated. Another fact tipping the favors for Harris is the 2022 and every special election since the Dobbs decision underestimating Democratic support by significant margins. 

On the other hand we do not have an election where Trump was on the ballot and pollsters did not underestimate his support; both 2016 and 2020.

Which scenario do you favor happening and what argument best support your position?",PoliticalDiscussion,0.0,2024-11-04,"2 days question answered; polls underestimating dems done since dobbs decision underestimating repubs done every time trump ballot ""2016 2020"". think happen argument supports position?"
1gj0euk,What is the solution to the extreme polarization of the United States in recent decades? ,2024-11-03 18:25:51,268,696,"It's apparent to everyone that political polarization in the United States has increased drastically over the past several decades, to the point that George Lang, an elected official in my state of Ohio, called for civil war if Trump doesn't win on election night. And with election day less than two days away, things around here are tense. Both sides agree that something needs to be done about the polarization, but what are realistic solutions to such an issue?",PoliticalDiscussion,-0.0625,2024-11-03,solution extreme polarization united states recent decades?
1gizwjg,"Assuming Kamala Harris wins, will the republicans that “supported” her over Trump immediately drop support once she’s in office? ",2024-11-03 18:03:01,1,1,"Assuming Kamala Harris wins, will the republicans that “supported” her over Trump support her efforts in office at all? Or will they immediately start blocking EVERYTHING she tries to do once in office? For example, if Kamala tries to pass abortion legislation, or the border bill, or voting reform, will all these same republicans then block her, regardless of what she tries to do? Or is there a glimmer of hope that non-MAGA GOP might try to actually get some of these things done? (Maybe the border bill is the easiest example that, theoretically, they could all get behind). ",PoliticalDiscussion,0.3,2024-11-03,"assuming kamala harris wins, republicans “supported” trump immediately drop support she’s office?"
1gixvv3,"What do you think is going to be a big surprise upset in this election, excluding the final presidential winner?",2024-11-03 16:33:46,263,387,"Like the title states, what do you think is going to be an unexpected result of this election. Lets ignore who's going to be the overall presidential winner, rather focus on a specific state if you think so.

Is a democrat going to win a senate race in TX?

Is the republican going to win the presidential race a guaranteed blue state?

Is a democrat going to win the governor race of a guaranteed red state?

Any unexpected outcome that might happen somewhere? ",PoliticalDiscussion,0.0,2024-11-03,"think going big surprise upset election, excluding final presidential winner?"
1gio43r,The cost of the inability to successful complete bipartisanship initiatives in the US ,2024-11-03 09:30:25,19,29,"The United States has a significant chance of electing a President and other political bodies that have demonstrated an unwillingness to work together across party lines to successfully pass legislation that is non-trivial.

We have seen recent cases where bipartisan efforts focused on important legislation were initiated but failed to become law when they were either blocked from reaching a vote or were voted down exclusively by the majority party in a branch of government. A high-profile recent example is the border security bill. This proposal was assembled largely and apparently with very significant effort by assigned members of a party at their own party's request, negotiated to gather bipartisan support, and then voted against by the same party that initiated it, ostensibly for political reasons.

The topic here explores how much this inability prevents the United States from effectively governing itself in the event there is not a ""sweep"" of the Presidency, the House and the Senate by the same party.

Each of these bodies, plus arguably the (unelected) court system, has its own individual powers, and some of those such as Presidential Executive Orders can have major impacts..

But is it valid to claim that for the most critical (?) requirements of long-term government on behalf of its citizens, for truly groundbreaking and profoundly wide-reaching legislated change that directly deal with major problems,

* when majorities split, a government consisting of bodies that are able to resolve bipartisan initiatives is fundamentally important;
* this ability has not been present for some time now, and
* the cost to the United States of not having such a capability is extraordinarily great, and the damage it is causing is extraordinarily high?

If the legislative bodies once again split to different majority parties, are there still means of accomplishing legislation? What important issues actually CAN be acted on to a successful completion if so?",PoliticalDiscussion,0.425,2024-11-03,cost inability successful complete bipartisanship initiatives us
1gin9zc,What Will the Non MAGA GOP do if trump loses?,2024-11-03 08:50:36,111,169,"Will they have to form a new party since Lara Trump is running the RNC? Or could they just try to beat the MAGA candidate in the primary? Could Lara still pick a maga candidate even if he/she loses the primary to a non maga candidate?
I dont know how the GOP operate so thats why i am asking",PoliticalDiscussion,-0.3,2024-11-03,non maga gop trump loses?
1gitjh1,Is there a real threat to overturning same sex marriage in the US if TRUMP wins?,2024-11-03 13:26:32,12,53,"If republicans seize control of the house, senate, and presidency, is there a real threat of overturning same sex marriage? What would happen to existing same sex marriages? 
Would current marriages be void? Is there even a real threat of marriage equality ?",PoliticalDiscussion,0.16666666666666666,2024-11-03,real threat overturning sex marriage us trump wins?
1giqb5r,Why do majority of white women support Trump?,2024-11-03 11:08:13,7,30,"From a neutral standpoint, looking at the voting patterns in the 2020 presidential elections, majority of white women supported Trump and voted Republicans whereas majority of other races or ethnicties of women voted Democrats. Is there a specific reason as to why the majority of white women support Trump and vote for Republicans? Has that anything to do with religion or being Evangelical Christian or just Christian in general? Also, after the overturning of Roe v. Wade, will that dramatically impact the voting patterns amongst white women or do majority of white women still despise abortions or despise the idea of making abortions legalized on a federal level?

Here's the link to the report that I referenced- 

https://www.pewresearch.org/politics/2021/06/30/behind-bidens-2020-victory/",PoliticalDiscussion,0.0,2024-11-03,majority white women support trump?
1giooyn,What specific features of political systems you in general disagree with do you actually like?,2024-11-03 09:57:15,11,57,"While the issue of senate confirmation has gotten more contentious recently, in general I actually do like the general concept and a number of the mechanisms available to the Senate to be thorough even though I think the underlying constitution badly needs major reforms. State senates don't have the same population biases, IE each senator represents about the same number of people, and generally no filibuster, and if a supermajority is ordered for some reason, it can be put directly in the constitution so no party or anyone else can override the need for such a margin.

In many places, you can pack your cabinet or boards with people far less inquired into and merely accepted with few to no questions or even the power to stop it in theory. Done well, and you can help to prevent yes men from being put into cabinets and can make people pick defendable persons, and this would be even more true with the general constitutional reforms I could think of like a more multi party system, ethics and transparency in political financing, stricter bans on nepotism and revolving door laws, procedure rules for unanimous consent and filibusters, direct election of the head of state by a majority system, and probably changes to the judiciary with respect to judge nominations.",PoliticalDiscussion,0.012500000000000004,2024-11-03,specific features political systems general disagree actually like?
1gioe95,Brass tacks time: who wins between Trump vs Harris and why?,2024-11-03 09:43:32,0,501,"What does your gut feel who will win the presidency regardless of your personal political partisanship? Take into account whatever information or analysis you want, but don't just favor your side just because you desire that outcome. Think of it as having to bet a million dollars on who actually wins.",PoliticalDiscussion,0.3,2024-11-03,brass tacks time: wins trump vs harris why?
1gin55i,"With only 2 days till Election Day, what can you do to help make an impact and what would your message be?",2024-11-03 08:44:12,59,84,"In this sub we talk a lot about what campaigns, politicians, and other people do.  With these last two days, what will YOU do to make the most impact?  If this is too meta, then what could the average redditor do?  And if you ran into one undecided voter at the poll, what is your final message to them?",PoliticalDiscussion,0.0,2024-11-03,"2 days till election day, help make impact would message be?"
1gihqxn,"Which state(s), if any, do you believe Harris/Walz will win that Biden/Harris did not win in 2020 (flip from red to blue)?",2024-11-03 02:40:36,190,306,"About three months ago, I asked this subreddit this same question. Link here: https://www.reddit.com/r/PoliticalDiscussion/s/rK73BoZ3z4

I then asked this subreddit again about a month and a half later. Link here: https://www.reddit.com/r/PoliticalDiscussion/s/Vf769xhNZE

As expected, many of the comments in the first two posts focused on the seven swing states (Michigan, Wisconsin, Pennsylvania, Arizona, Nevada, Georgia, North Carolina) as states to watch for, with North Carolina in particular being the only realistic state Harris/Walz could flip (but that Trump/Vance could potentially flip any combination of the other six states that Biden/Harris won in 2020). However, some comments also mentioned possibly watching for Florida, Ohio, and/or Texas, but that’s NC remained the only realistic flip from red to blue.

And now, two days before the election, I’m going to ask this subreddit one more time, with slightly different wording now that campaigning is nearly done.

Which state(s), if any, do you believe Harris/Walz will win that Biden/Harris did not win in 2020 (flip from red to blue)? I encourage you to also include your reasoning or multiple reasons why you believe so (including but not limited to: polling or a specific poll(s), fundraising numbers, crowd sizes, early voting demographics, states each candidate/campaign visits, the economy, Roe v Wade, general vibes).

A lot has happened in the past month and a half or so since I last asked this question, so any specific events too could be valid reasons for predictions.

Bonus question: Which state(s), if any, do you believe Trump/Vance will win that Trump/Pence did not win in 2020 (flip from blue to red)?",PoliticalDiscussion,0.1,2024-11-03,"state(s), any, believe harris/walz win biden/harris win 2020 (flip red blue)?"
1gifc55,Are there any major rumors who Kamala’s cabinet may include? Who would you pick?,2024-11-03 00:45:25,58,168,Trump has made it known who he likes and would consider. But I have yet to hear anything from Kamala Harris. (Unless I missed it). I am curious since it seems she’d deviate a bit from who is in President Joe Biden’s cabinet. ,PoliticalDiscussion,0.0625,2024-11-03,major rumors kamala’s cabinet may include? would pick?
1gi9i0c,Texas & Florida barring DOJ poll watchers,2024-11-02 19:30:02,251,45,"News came out today that both Florida Governor Desantis and Texas Governor Abbott have informed the Department of Justice that any Federal poll watcher is forbidden from entering poll locations in their states.

Do you believe this will make any impact on the election? Is this just political posturing by some of the more conservative governors in the country? Will the DOJ push the issue, and if so how much will the states push back?

Sources:  
[https://www.newsweek.com/texas-barrs-federal-poll-watchers-1979067](https://www.newsweek.com/texas-barrs-federal-poll-watchers-1979067)

[https://www.orlandosentinel.com/2024/11/01/justice-department-dispatches-election-monitors-to-florida-but-state-leaders-say-they-cant-enter-polling-sites/](https://www.orlandosentinel.com/2024/11/01/justice-department-dispatches-election-monitors-to-florida-but-state-leaders-say-they-cant-enter-polling-sites/)",PoliticalDiscussion,0.0,2024-11-02,texas florida barring doj poll watchers
