id,title,created_utc,score,num_comments,selftext,subreddit,sentiment,date,cleaned_title
1fihahh,Is Tim Walz  a rarity in American politics when it comes to background ?,2024-09-16 17:57:56,426,259,"Is Tim Walz a rarity in American politics ? 

How rare is it for someone like Walz to become an high ranking politician ? He never went to an Ivy League, never had that much connections, was a teacher, and only won to become a congressman and then governor ?because of sheer hard work and talent. Will we see a shift with more national politicians from the “ state “ schools rather than Ivy leagues? Those with normal jobs ?",PoliticalDiscussion,0.0,2024-09-16,tim walz rarity american politics comes background
1fic2qg,Is Trump keeping attention on himself a negative thing from the point of view of the Harris campaign?,2024-09-16 14:30:13,263,98,"
There was an interesting article in the Bulwark today

https://www.thebulwark.com/p/trump-is-the-main-character-of-2024


To summarize, the article basically states that Trump wants the news cycle to be about him, and has distracted from his horrible debate performance to discussion of his false claims about pets being eaten in Springfield 

Taking it as a given that Trump always wants to be the center of attention, one of the claims that some ""undecided"" voters still make is that they don't know enough about Harris to support her yet

So, questions:

* Is the election being a referendum on Trump to the benefit of Harris?

* How much more ""stuff"" would nominally undecided voters need to know to support her? Or, putting it a different way, is ""I want to know more"" actually a widespread concern?

* Can Trump successfully keep enough attention on himself that Harris cannot give undecided voters the information they claim to want?

* How can Harris take the focus away from Trump if she wants to?",PoliticalDiscussion,-0.3,2024-09-16,trump keeping attention negative thing point view harris campaign?
1fi67yu,How much transparency do you think is necessary for discussions held in the executive branch?,2024-09-16 10:35:30,15,21,"Legislatures debate in public all the time, the courts don't publish as many debates among judges but you can still go to courtrooms and see the proceedings. But actual minutes and footage (and audio) of executive meetings tend to not be so published.",PoliticalDiscussion,0.1,2024-09-16,much transparency think necessary discussions held executive branch?
1fi2lfd,"Could Kamala Harris Win Against a Candidate Like Mitt Romney, or Is Trump Making Her Look Stronger?",2024-09-16 07:51:47,9,28,"So, with Kamala Harris as the new Democratic nominee, we’re seeing a lot of her rallies and interviews, not to mention the debates. I think we can all agree that Trump really doesn’t deserve to be elected president again, given his chaotic and polarizing track record. The contrast between Harris and Trump is massive, and to many, that makes her the obvious choice. 

But here’s what I’ve been thinking about: when I listen to Harris in rallies, her talking points about growing up middle class and creating an ""opportunity economy"" sound great. These are the kind of lines that fire people up. But in interviews, wouldn’t it make sense for her to go a bit deeper into policy instead of repeating the same points?

I’ve watched a lot of interviews with Obama, and he just seems so thorough and “professor-like” in his answers. He digs into the details and shows that he knows exactly what he’s talking about. Obama didn’t just stick to talking points; he broke down complex issues like healthcare, the economy, or foreign policy in a way that felt really thoughtful. Harris, on the other hand, sometimes feels like she stays a bit on the surface.

Could Kamala Harris still be as ahead if she were running against someone like Mitt Romney - someone who gave Obama a close race rather than Donald Trump? Trump creates this obvious stability vs. chaos contrast, where Harris benefits from simply being a competent, level-headed alternative. 

But what if she were running against someone more conventional, someone more focused on policy like Mitt Romney? Romney, for all his faults, gave Obama a close race back in 2012, largely because he came across as competent, experienced, and well-versed in policy.

 In that kind of race, could Harris’ style hold up as well? Would she need to shift away from the broad emotional appeals and start digging into the kind of policy depth that Obama was so good at?

Would love to hear your thoughts!",PoliticalDiscussion,0.8,2024-09-16,"could kamala harris win candidate like mitt romney, trump making look stronger?"
1fhy9db,Enforcing a 24hr Ukraine/Russia peace plan?,2024-09-16 02:48:38,89,212,"Over time, Trump and [Vance](https://www.washingtonpost.com/politics/2024/09/12/vance-trump-ukraine-russia-war-plan/) have been encouraged by journalists and interviewers to reveal a few details of how they will go about achieving their promise of a ceasefire in Ukraine ""within 24 hours"".

This seems to involve Ukraine gifting 20% of its territory to Russia and a buffer zone being created in exchange for Russia promising not to resume hostilities. 

Putting aside what will happen to  the Ukrainians in that territory and the 100's of thousands who have already been kidnapped into Russia, Russia has a long history of breaking these types of territorial agreements.

It's unlikely ukraine or it's allies would accept these terms; how does Trump propose enforcing the agreement? 
**Does this mean US troops on the ground in Ukraine?**

This is an Important question I'd like to see answered.


I'm a Brit, living in the UK. This Trump policy is likely to effect Europeans more than any other.",PoliticalDiscussion,0.0,2024-09-16,enforcing 24hr ukraine/russia peace plan?
1fhvm5x,What are supporters of Harris and supporters of Trump afraid of if the opposite candidate wins?  ,2024-09-15 23:55:08,1,4,"If fear can be an influencing factor in how people vote, and political campaigns often use these fears to their advantage, what are supporters on each side of the upcoming presidential election (Harris vs. Trump) afraid of if their candidate loses?  What are the facts, statistics, actions, etc to back up and rationalize these fears?  Bonus points for links / resources.  I am hoping to approach this from a non-emotional perspective.",PoliticalDiscussion,-0.09999999999999999,2024-09-15,supporters harris supporters trump afraid opposite candidate wins?
1fhraip,Is the Democratic Party Really Shifting Toward the Center?,2024-09-15 20:12:29,1,1,"There’s been a lot of discussion recently about the Democratic Party moving toward the center, but I’m struggling to see any major evidence of this being a new shift. If we look at the past several presidential candidates—Bill Clinton, Al Gore, John Kerry, Barack Obama, Hillary Clinton, Joe Biden, and now Kamala Harris—none of them seem to fit the description of true progressives. Most of these candidates have embraced centrist policies, often appealing to moderates and independents rather than the more progressive wing of the party.

While some argue that recent Democratic platforms are more progressive on issues like healthcare and climate change, are these shifts substantial enough to be called a move toward the left? Or are they simply keeping pace with changing public opinion while maintaining a centrist core?

In the lead-up to the 2020 Democratic primaries, centrist candidates and establishment figures quickly consolidated their influence, rallying behind Joe Biden after early victories by more left-wing contenders like Bernie Sanders. As the primary unfolded, the moderate wing of the party wielded its power to sideline populist candidates and their policies, pushing for a more “electable” candidate in Biden. This realignment led to the abandonment of progressive healthcare reform, with Medicare for All falling out of favor. Similarly, despite the mass mobilization of Black Lives Matter protests and the popularity of environmental movements like the Green New Deal, these causes were largely deprioritized by the establishment. As Biden took office, there was minimal progress on both fronts, leaving the populist left frustrated and seeing little meaningful advancement on these key issues. The graph of influence shows the centrist bloc spiking in power as the primaries progressed, while momentum for progressive policies flattened post-election.

Would this not be seen as centrist continuity?",PoliticalDiscussion,0.05,2024-09-15,democratic party really shifting toward center?
1fhphe6,"Man armed with AK-47 400-500 yards hiding in bushes at the sixth hole on Trump's golf course, lying in wait. Agents spotted the rifle and shot. Suspect later apprehended. He is not cooperating. Trump said he will not surrender. What additional safety measures must be taken to protect our leaders? ",2024-09-15 18:46:51,0,435,"This is the second attempt on Trump's life in about two months. These are very troubling developments. No one knows how the suspect got exact information where Trump would be on the golf course. Aside from AK 47 the suspect had a go pro camera and a video, along with two backpacks. Agents opened fire when they spotted the rifle barrel behind the bushes.  Suspect fled in a car and was later apprehended and is not cooperating. 

Trump tweeted; he will not surrender.  This time secret service was more alert and spotted the rifle before suspect could fire a shot. Both, President Biden and V.P. Kamala Harris were briefed and Harris tweeded she is glad the president is safe. Everything is on lock down. They are kept updated.  

Whatever one may think of Trump, these attempts are getting out of hand and very concerning. I am at a loss as to what additional measures can be taken to protect our leaders here and abroad.

What additional safety measures must be taken to protect our leaders?   

  
[https://www.cnn.com/politics/live-news/trump-harris-election-09-15-24/index.html](https://www.cnn.com/politics/live-news/trump-harris-election-09-15-24/index.html)",PoliticalDiscussion,0.0,2024-09-15,"man armed ak-47 400-500 yards hiding bushes sixth hole trump's golf course, lying wait. agents spotted rifle shot. suspect later apprehended. cooperating. trump said surrender. additional safety measures must taken protect leaders?"
1fgzs45,Is Biden wrong to impose 100% tariffs on Chinese EVs? Was it to protect US manufacturers or US consumers? ,2024-09-14 20:08:53,3,36,"Was it to protect US manufacturers from sizable competition? Or does he think they're inferior product and he's protecting US consumers? 

I just heard Al Franken say this. That Biden was wrong to do this and it got me thinking. ",PoliticalDiscussion,-0.25,2024-09-14,biden wrong impose 100% tariffs chinese evs? protect us manufacturers us consumers?
1fhhuje,How will the Republican Party survive after Trump?,2024-09-15 13:21:00,312,269,"The Republican Party in the US ever since Donald Trump has become president, and especially after he lost in 2020, has almost completely restructured to be centered around him and their support of him. There are exceptions of course but if Republican politicians want to survive electorally they have to be sycophantic in their support for Trump, lie for him, kiss his ring and even believe and justify everything he says a regardless of how untrue or otherwise disgusting it is. 

Even the RNC itself has a member of the trump family at it’s head. Legislatures and congress pass or don’t pass bills based off of what Trump demands, and it’s very rare for republicans who do not like trump(be it politicians or even average people) to not become pariahs of the GOP or even family members. 

And my question is what will happen to the GOP once trump is gone? He’s an old man and clearly in poor health. He will die of old age one day but because the GOP is centered around him and no one else who has tried to become his successor has succeeded or been anywhere near as successful(DeSantis, JD Vance, etc.) how will the GOP survive? 

Having studied cults and and cults of personality in particular for a long time, to me there are only three options: either the whole party essentially collapses and devolves into infighting, destroying itself in the process much like Millerites, the  GOP undergoes a process akin to de-Stalinization such as what happened in the USSR under Khrushchev and moderates itself somewhat, or an insofar unnamed successor emerges from an internal power struggle and becomes the new charismatic leader of the party(IE: David Miscavage from Scientology or JF Rutherford of the Jehovah’s Witnesses).

What do you think will happen, any of these or something else I didn’t think of? ",PoliticalDiscussion,0.0,2024-09-15,republican party survive trump?
1fhf914,What state do you believe is a “secret” swing state?,2024-09-15 11:31:51,193,283,"People have their eyes on PA, GA, NC, WI, MI, NV, AZ with PA being the potential election decider. But what other states do you believe could potentially shift further towards one side of the spectrum than the last few elections?

A couple I can think of top of my head would perhaps be TX shifting towards striking range, but Ken Paxton is working over time to ensure there’s no shimmer of Blue vote from that state by removing a million from the voter rolls. It’s worth noting half were deceased but there’s majority remove for “failure to file” maybe due to change in address.

I also think Ohio might shift a little more towards blue due to this whole migrant eating pets story fabrication.",PoliticalDiscussion,-0.4,2024-09-15,state believe “secret” swing state?
1fh8kyq,"Whay have we not seen much ""Stumping"" for down ticket races?",2024-09-15 05:23:31,1,4,"From what I've seen of US elections, the nominee (or POTUS) will often times show their support for tight or important races for the house and senate by campaigning along side the lower ticket candidate.

Eg Allred for Texas senate (Harris) or Boebert CO4  (Trump)

That doesn't seem to be happening this cycle.

Do you believe that could have an effect on results in November?",PoliticalDiscussion,0.022222222222222227,2024-09-15,"whay seen much ""stumping"" ticket races?"
1fhlkfb,A recent nationally recognized poll places Kamala just 4 points behind Trump in Iowa and the 3 district elections place the democratic candidates 3% ahead of their GOP incumbents. Has this Midwestern state suddenly become a battleground state for the Election?,2024-09-15 15:55:52,1,1,"The past 2 Elections placed Iowa as a solidly red state with a heavy lean towards Trump, for many political observers and analysts, this made Iowa a non-option for Democratic political rallies and candidacy despite its previously purple standings with Obama winning the state in 2008 and 2012. 

With this new data surfacing and dated to before the Debate, does this create a new front for Kamala to further outpace Trump in this election? 

https://www.desmoinesregister.com/story/news/politics/iowa-poll/2024/09/15/iowa-poll-donald-trump-iowa-lead-shrinks-as-kamala-harris-replaces-joe-biden/75180245007/",PoliticalDiscussion,-0.13333333333333333,2024-09-15,recent nationally recognized poll places kamala 4 points behind trump iowa 3 district elections place democratic candidates 3% ahead gop incumbents. midwestern state suddenly become battleground state election?
1fhaom8,Can the GOP reconcile their positions on abortion and IVF?,2024-09-15 07:49:24,42,76,"[https://www.cnn.com/2024/09/15/politics/house-republican-ivf-fight/index.html](https://www.cnn.com/2024/09/15/politics/house-republican-ivf-fight/index.html)

There is currently an effort underway within the GOP to sponsor legislation expressing support for IVF. There also seems to be a lot of confusion out there regarding how the two issues are related, even within Congress.

Context for clarity:

- IVF necessarily involves the destruction of fertilized embryos as part of the process (not all embryos are utilized)

- Hardline abortion opponents believe that life begins at conception

Will the GOP be able to articulate a position that both works for moderate Republicans and swing voters without completely alienating their anti abortion base?",PoliticalDiscussion,0.0,2024-09-15,gop reconcile positions abortion ivf?
1fh0iqb,"For the first time in decades, the U.S. gender wage gap has widened. What do you think caused this, and what can be done to address it?",2024-09-14 20:48:25,15,15,"Link to a few articles going more into it:

* https://www.axios.com/2024/09/11/gender-wage-gap-rate-earnings
* https://www.inc.com/sara-deeter/report-gender-pay-gap-worsened-in-2023.html

The key findings are that full time female workers made 83 cents for every dollar a man made last year, down from 84 cents the year before. The decrease was particularly felt among minority women, with Black women falling to just 66 cents on the dollar while Asian women fell from 98.6 cents to 94. The declines mark the first statistically significant decrease (as defined by the US Census Bureau) in the ratio of female to male earnings since 2003. 

What do you think it's down to? In recent years we saw COVID-19 shutdowns affect female employment greater than men, and the overturning of national abortion rights with the fall of Roe v. Wade. Do you think these are factors? The Axios piece argues that societal sexism still plays a role. And in recent times we've seen American conservatives to various extents call for a limiting of things like no-fault divorce and contraceptives. What impact is a restriction of these likely to have on female employment and job prospects?",PoliticalDiscussion,0.25,2024-09-14,"first time decades, u.s. gender wage gap widened. think caused this, done address it?"
1fhdps1,How can Harris improve public opinion concerning how she would handle the economy?,2024-09-15 10:25:12,78,304,"Harris is up in the popular vote, but still neck and neck with Trump to win the election. “The economy” is consistently voted the most pressing issue for voters this election among likely voters, and Trump consistently beats her in the same polls for how they would handle the economy.

What can Kamala do to fix this problem?",PoliticalDiscussion,0.0,2024-09-15,harris improve public opinion concerning would handle economy?
1fh6adl,Venezuela claims a plot to assassinate Maduro and other leaders in the government backed by CIA and coordinated with Spain was foiled.  Among those arrested is a member of Navy Seal. U.S. denies plot. Can we give any credence to this allegation? ,2024-09-15 02:36:04,91,171,"The US state department confirmed the detention of a U.S. Military member and said it was aware of the reports of two additional US citizens detained in Venezuela.

The State Department stated: “Any claims of US involvement in a plot to overthrow Maduro are categorically false. The United States continues to support a democratic solution to the political crisis in Venezuela.”

Similar accusations were made in the past. In 2020, 13 people were arrested in Venezuela including Luke Denman; Venezuela said they were ""mercenaries"" whose armed incursion was foiled. At that time Maduro accused US President Donald Trump of trying to invade the country and overthrow him.

Previously, \[August 4, 2018\] Maduro had accused U.S. of attempting to assassinate him by use of two explosive drones. Maduro then survived an assassination attempt which occurred while he was giving a speech at a military ceremony in Caracas. The two drones exploded injuring soldiers. Maduro claimed U.S. and Columbia was behind it. 

It is possible now Maduro and his government will escalate the ongoing crackdown of the opposition with the announcement 6 individuals who were in possession of 400 machine guns.  

Can we give any credence to this allegation? 

[Venezuela says it arrested 6 foreigners allegedly involved in a plot to kill President Maduro - ABC News (go.com)](https://abcnews.go.com/International/wireStory/venezuela-arrested-6-foreigners-allegedly-involved-plot-kill-113693527)

",PoliticalDiscussion,-0.125,2024-09-15,venezuela claims plot assassinate maduro leaders government backed cia coordinated spain foiled. among arrested member navy seal. u.s. denies plot. give credence allegation?
1fh1fak,What is the future for the Republican party if Texas flips?,2024-09-14 21:38:24,0,1,"I've seen a lot of people talk about Texas potentially flipping blue in the next few election cycles on this sub. If that happens and the Electoral College remains, it would be pretty much impossible for Republicans to win a Presidential Election with NY, CA, and TX and Florida as a potential swing state they might be able to flip in some elections. Especially with Georgia trending Blue over time and North Carolina, could we start to see Republicans be the party calling for abolishing the Electoral College, with the Democrats trying to keep it?",PoliticalDiscussion,0.0,2024-09-14,future republican party texas flips?
1fgy20s,"Should Harris debate Trump again, if Trump is so inclined? ",2024-09-14 18:43:23,312,454,"Why or why not? Also, who would be most hurt or helped by another debate?

If Trump has a decent (but not great) outing, would it go a long way to helping him? Conversely, if Kamala does reasonably well (but not great) will that hurt or help her overall?",PoliticalDiscussion,0.0,2024-09-14,"harris debate trump again, trump inclined?"
1fgtuol,Will the US ever actually improve its democracy and election systems?,2024-09-14 15:26:49,53,136,"One of the few issues that’s agreed upon by the right and left is the US is that our election systems and democracy are. Very flawed. Granted, these thoughts are held for extremely different reasons: the right thinks it’s flawed because their guy says so, with no hard evidence or examples. The left thinks it flawed because the US has a history of disenfranchising large categories of people such as women, Blacks, Native Americans, people of color, etc, all who have had to fight and struggle for their right to vote. This disenfranchisement continues today, most notably with felon disenfranchisement laws in various states, as well as measures to simply limit and restrict voting.

And let’s not forget that the Electoral College was constructed specifically to prevent the ‘will of the people’ from winning an election, and/or -ironically- to prevent someone wholly unfit to hold office, or a foreign power who would subvert the popular vote to become president.

Finally, something not discussed enough: the current election system with it’s two-year cycle, is a multi-hundred billion dollar industry, an industry that feeds on this rather dysfunctional system. Lots of people make lots of money with the status quo, no matter how unpopular and flawed it is. The US does not have a habit of disrupting industries that are so money-driven, especially when those who make the laws also profit from that industry.

But will the US ever actually do something about it?

And if so, what’s the most likely change that the US will make?",PoliticalDiscussion,0.0,2024-09-14,us ever actually improve democracy election systems?
1fgnwbp,Will the claims of Haitians eating pets have a significant impact on the Florida result?,2024-09-14 10:54:42,81,82,"Just to clarify, I am English, so I apologise if this ends up being a dumb question. 

Florida has been a semi-swing state for decades, the 2000 election came down to Florida. At present Ron DeSantis is a very polarising figures and Florida could be in play again this election. 

With that in mind, will the attacks specifically on Haitians cost the GOP Florida? It’s a state with a significant Haitian immigrant population and they can’t be happy at being characterised as pet eaters. Or is the Haitian community in Florida too small to have any real impact? ",PoliticalDiscussion,0.375,2024-09-14,claims haitians eating pets significant impact florida result?
